{
  "schema_version": "target.v1",
  "binding_id": "binding-1",
  "revision": 1,
  "provider": "fixture-grok",
  "origin": "https://fixture.invalid",
  "account_ref": "fixture:account",
  "workspace_ref": null,
  "conversation_ref": "fixture:conversation",
  "repo_ref": "fixture:repo",
  "branch_ref": "fixture:branch",
  "identity_evidence_refs": [
    "fixture:observation"
  ],
  "adapter_ref": "fixture:adapter",
  "adapter_version": "1",
  "ui_contract_digest": "0000000000000000000000000000000000000000000000000000000000000000",
  "identity_digest": "0000000000000000000000000000000000000000000000000000000000000000",
  "transient_handle": "fixture:tab-17",
  "state": "BOUND"
}
